Title,Url
Soupe à l'oignon gratinée,https://www.marmiton.org//recettes/recette_soupe-a-l-oignon-gratinee_20864.aspx
Tarte à l'oignon rapide,https://www.marmiton.org//recettes/recette_tarte-a-l-oignon-rapide_26201.aspx
Soupe à l'oignon,https://www.marmiton.org//recettes/recette_soupe-a-l-oignon_10891.aspx
Poulet curry et oignons facile,https://www.marmiton.org//recettes/recette_poulet-curry-et-oignons-facile_13026.aspx
Pizza courgette oignon crème feta,https://www.marmiton.org//recettes/recette_pizza-courgette-oignon-creme-feta_354908.aspx
Rôti de boeuf à l'oignon caramélisé,https://www.marmiton.org//recettes/recette_roti-de-boeuf-a-l-oignon-caramelise_63016.aspx
Escalopes à l'oignon,https://www.marmiton.org//recettes/recette_escalopes-a-l-oignon_18784.aspx
Quiche à l'oignon et aux lardons fumés,https://www.marmiton.org//recettes/recette_tarte-a-l-oignon_28444.aspx
Filet mignon et fondue d'oignon en croûte,https://www.marmiton.org//recettes/recette_filet-mignon-et-fondue-d-oignon-en-croute_39353.aspx
"Piments farcis au blé, oignon et champignon",https://www.marmiton.org//recettes/recette_piments-farcis-au-ble-oignon-et-champignon_359422.aspx
Soupe à l'oignon facon grand-mère,https://www.marmiton.org//recettes/recette_soupe-a-l-oignon-facon-grand-mere_62658.aspx
Paupiettes de veau aux oignons et tomates,https://www.marmiton.org//recettes/recette_paupiettes-de-veau-aux-oignons-et-tomates_17872.aspx
Gigot sur lit d'oignon,https://www.marmiton.org//recettes/recette_gigot-sur-lit-d-oignon_19036.aspx
Gratin lardons et oignons,https://www.marmiton.org//recettes/recette_gratin-lardons-et-oignons_13853.aspx
"Quesadillas au bacon, fromage et oignon",https://www.marmiton.org//recettes/recette_quesadillas-au-bacon-fromage-et-oignon_354867.aspx
